{
  "schemaVersion": 4,
  "kind": "spurGear",
  "units": "mm",
  "rim": {
    "module": 1,
    "toothCount": 30,
    "pressureAngle": 20,
    "profileShift": 0,
    "backlash": 0.1,
    "width": 6,
    "radialThickness": 2
  },
  "flanges": {
    "lower": null,
    "upper": null
  },
  "web": {
    "type": "solid",
    "thinning": 0,
    "alignment": "lower",
    "axialOffset": 0
  },
  "hub": {
    "outerDiameter": 10,
    "lowerExtension": 0,
    "upperExtension": 0
  },
  "bore": { "shape": "round", "diameter": 5 },
  "generation": {
    "maxChordError": 0.03
  }
}
