{
  "schemaVersion": 4,
  "kind": "timingPulley",
  "units": "mm",
  "rim": {
    "profile": "gt2-2mm-experimental-v1",
    "toothCount": 60,
    "width": 9,
    "radialThickness": 2
  },
  "flanges": {
    "lower": {
      "axialThickness": 0.8,
      "radialExtension": 1
    },
    "upper": {
      "axialThickness": 1.2,
      "radialExtension": 1.5
    }
  },
  "web": {
    "type": "spokes",
    "thinning": 7,
    "alignment": "center",
    "axialOffset": -0.2,
    "count": 6,
    "width": 3,
    "filletRadius": 1
  },
  "hub": {
    "outerDiameter": 12,
    "lowerExtension": 1.2,
    "upperExtension": 1.8
  },
  "bore": { "shape": "round", "diameter": 5.2 },
  "generation": {
    "maxChordError": 0.04
  }
}
